{
  "$schema": "https://json-schema.org/draft/2020-12/schema",
  "$id": "https://geo-vault.local/schemas/bd/admin2.schema.json",
  "title": "Bangladesh District (Admin Level 2)",
  "type": "object",
  "required": [
    "id",
    "division_id",
    "name",
    "bn_name",
    "slug",
    "country_code",
    "admin_level",
    "pcode",
    "division_pcode",
    "lat",
    "lon",
    "center_lat",
    "center_lon",
    "area_sqkm",
    "url",
    "upazila_count",
    "union_count"
  ],
  "additionalProperties": false,
  "properties": {
    "id": { "type": "string" },
    "division_id": { "type": "string" },
    "name": { "type": "string" },
    "bn_name": { "type": "string" },
    "slug": { "type": "string" },
    "country_code": { "type": "string" },
    "admin_level": { "type": "string" },
    "pcode": { "type": "string" },
    "division_pcode": { "type": "string" },
    "lat": { "type": "string" },
    "lon": { "type": "string" },
    "center_lat": { "type": "string" },
    "center_lon": { "type": "string" },
    "area_sqkm": { "type": "string" },
    "url": { "type": "string" },
    "upazila_count": { "type": "string" },
    "union_count": { "type": "string" }
  }
}
